Authors	RECOMB 2018 Paper Title (Original)	LNCS 10812 Pages	LNCS 10812 DOI	Preprint	Journal Name	Title in Journal Version	Journal Authors	Journal Volume, Issue, and Pages	Journal Publication Year	Journal Version DOI
Anton Bankevich and Pavel Pevzner	Long Reads Enable Accurate Estimates of Complexity of Metagenomes	1-20	10.1007/978-3-319-89929-9_1							
Shounak Chakraborty, Stefan Canzar, Tobias Marschall, Marcel H. Schulz	Chromatyping: Reconstructing Nucleosome Profiles from NOME Sequencing Data	21-36	10.1007/978-3-319-89929-9_2		Journal of Computational Biology	Chromatyping: Reconstructing Nucleosome Profiles from NOMe Sequencing Data	Shounak Chakraborty, Stefan Canzar, Tobias Marschall, Marcel H. Schulz	27(3):330-341	2020	10.1089/cmb.2019.0457
Ali Ebrahimpour Boroojeny, Akash Shrestha, Ali Sharifi-Zarchi, Suzanne Renick Gallagher, S. Cenk Sahinalp, Hamidreza Chitsaz	GTED: Graph Traversal Edit Distance	37-53	10.1007/978-3-319-89929-9_3							
Cyril Galitzine, Pierre M. Jean Beltran, Ileana M. Cristea, Olga Vitek	Statistical Inference of Peroxisome Dynamics	54-74	10.1007/978-3-319-89929-9_4							
Franziska Görtler, Stefan Solbrig, Tilo Wettig, Peter J. Oefner, Rainer Spang, Michael Altenbuchinger	Loss-Function Learning for Digital Tissue Deconvolution	75-89	10.1007/978-3-319-89929-9_5							
Tyler A. Joseph and Itsik Pe'er	Inference of Population Structure from Ancient DNA	90-104	10.1007/978-3-319-89929-9_6							
Anna Kuosmanen, Topi Paavilainen, Travis Gagie, Rayan Chikhi, Alexandru Tomescu, Veli Mäkinen	Using Minimum Path Cover to Boost Dynamic Programming on DAGs: Co-linear Chaining Extended	105-121	10.1007/978-3-319-89929-9_7							
Gary Larson, Jeffrey L. Thorne, Scott Schmidler	Modeling Dependence in Evolutionary Inference for Proteins	122-137	10.1007/978-3-319-89929-9_8							
Sujun Li, Alex DeCourcy, Haixu Tang	Constrained De Novo Sequencing of neo-Epitope Peptides Using Tandem Mass Spectrometry	138-153	10.1007/978-3-319-89929-9_9							
Yaron Orenstein	Reverse de Bruijn: Utilizing Reverse Peptide Synthesis to Cover All Amino Acid k-mers	154-166	10.1007/978-3-319-89929-9_10							
Sebastien Roch and Kun-Chieh Wang	Circular Networks from Distorted Metrics	167-176	10.1007/978-3-319-89929-9_11							
Antoine Soulé, Jean-Marc Steyaert, Jérôme Waldispühl	A Nested 2-Level Cross-Validation Ensemble Learning Pipeline Suggests a Negative Pressure Against Crosstalk snoRNA-mRNA Interactions in Saccharomyces Cerevisae	177-193	10.1007/978-3-319-89929-9_12		Journal of Computational Biology	A Nested 2-Level Cross-Validation Ensemble Learning Pipeline Suggests a Negative Pressure Against Crosstalk snoRNA-mRNA Interactions in Saccharomyces cerevisiae	Antoine Soulé, Jean-Marc Steyaert, Jérôme Waldispühl	27(3):390-402	2020	10.1089/cmb.2019.0401
Yuriy Sverchkov, Yi-Hsuan Ho, Audrey Gasch, Mark Craven	Context-Specific Nested Effects Models	194-210	10.1007/978-3-319-89929-9_13							
Sharma V. Thankachan, Chaitanya Aluru, Sriram P. Chockalingam, Srinivas Aluru	Algorithmic Framework for Approximate Matching Under Bounded Edits with Applications to Sequence Analysis	211-224	10.1007/978-3-319-89929-9_14							
Zhemin Zhou, Nina Luhmann, Nabil-Fareed Alikhan, Christopher Quince, Mark Achtman	Accurate Reconstruction of Microbial Strains from Metagenomic Sequencing Using Representative Reference Genomes	225-242	10.1007/978-3-319-89929-9_15							
Mehrdad Bakhtiari, Sharona Shleizer-Burko, Melissa Gymrek, Vikas Bansal, Vineet Bafna	Targeted Genotyping of Variable Number Tandem Repeats with AdVNTR	243-244	10.1007/978-3-319-89929-9							
Tristan Bepler, Andrew Morin, Alex J. Noble, Julia Brasch, Lawrence Shapiro, Bonnie Berger	Positive-Unlabeled Convolutional Neural Networks for Particle Picking in Cryo-electron Micrographs	245-247	10.1007/978-3-319-89929-9		Nature Methods	Positive-unlabeled convolutional neural networks for particle picking in cryo-electron micrographs	Tristan Bepler, Andrew Morin, Micah Rapp, Julia Brasch, Lawrence Shapiro, Alex J. Noble, Bonnie Berger	16:1153–1160	2018	10.1038/s41592-019-0575-8
Édouard Bonnet, Paweł Rzążewski, Florian Sikora	Designing RNA Secondary Structures Is Hard	248-250	10.1007/978-3-319-89929-9	arXiv:1710.11513 [cs.DS]	Journal of Computational Biology	Designing RNA Secondary Structures Is Hard	Édouard Bonnet, Paweł Rzążewski, Florian Sikora	27(3):302-316	2020	10.1089/cmb.2019.0420
Hyunghoon Cho, Bonnie Berger, Jian Peng	Generalizable Visualization of Mega-Scale Single-Cell Data	251-253	10.1007/978-3-319-89929-9							
G. Durif, L. Modolo, J. E. Mold, S. Lambert-Lacroix, F. Picard	Probabilistic Count Matrix Factorization for Single Cell Expression Data Analysis	254-255	10.1007/978-3-319-89929-9		Bioinformatics	Probabilistic count matrix factorization for single cell expression data analysis	Ghislain Durif, Laurent Modolo, Jeff E Mold, Sophie Lambert-Lacroix, Franck Picard	35(20):4011-4019	2019	10.1093/bioinformatics/btz177
Stefan Hammer, Yann Ponty, Wei Wang, Sebastian Will	Fixed-Parameter Tractable Sampling for RNA Design with Multiple Target Structures	256-258	10.1007/978-3-319-89929-9							
Linh Huynh and Fereydoun Hormozdiari	Contribution of Structural Variation to Genome Structure: TAD Fusion Discovery and Ranking	259-260	10.1007/978-3-319-89929-9							
Mikhail Kolmogorov, Jeffrey Yuan, Yu Lin, Pavel Pevzner	Assembly of Long Error-Prone Reads Using Repeat Graphs	261-262	10.1007/978-3-319-89929-9							
Mark D. M. Leiserson, Jason Fan, Anthony Cannistra, Inbar Fried, Tim Lim, Thomas Schaffner, Mark Crovella, Benjamin Hescott	A Multi-species Functional Embedding Integrating Sequence and Network Structure	263-265	10.1007/978-3-319-89929-9							
Yunan Luo, Jianzhu Ma, Yang Liu, Qing Ye, Trey Ideker, Jian Peng	Deciphering Signaling Specificity with Deep Neural Networks	266-268	10.1007/978-3-319-89929-9							
Salem Malikic, Katharina Jahn, Jack Kuipers, S. Cenk Sahinalp, Niko Beerenwinkel	Integrative Inference of Subclonal Tumour Evolution from Single-Cell and Bulk Sequencing Data	269-270	10.1007/978-3-319-89929-9							
Prashant Pandey, Fatemeh Almodaresi, Michael A. Bender, Michael Ferdman, Rob Johnson, Rob Patro	Mantis: A Fast, Small, and Exact Large-Scale Sequence-Search Index	271-273	10.1007/978-3-319-89929-9							
Elior Rahmani, Regev Schweiger, Saharon Rosset, Sriram Sankararaman, Eran Halperin	Tensor Composition Analysis Detects Cell-Type Specific Associations in Epigenetic Studies	274-275	10.1007/978-3-319-89929-9							
Shahab Sarmashghi, Kristine Bohmann, M. Thomas P. Gilbert, Vineet Bafna, Siavash Mirarab	Assembly-Free and Alignment-Free Sample Identification Using Genome Skims	276-277	10.1007/978-3-319-89929-9		Genome Biology	Skmer: assembly-free and alignment-free sample identification using genome skims	Shahab Sarmashghi, Kristine Bohmann, M. Thomas P. Gilbert, Vineet Bafna, Siavash Mirarab	20(1):34	2019	10.1186/s13059-019-1632-4
Rebecca Sarto Basso, Dorit S. Hochbaum, Fabio Vandin	Efficient Algorithms to Discover Alterations with Complementary Functional Association in Cancer	278-279	10.1007/978-3-319-89929-9		PLOS Computational Biology	Efficient algorithms to discover alterations with complementary functional association in cancer	Rebecca Sarto Basso, Dorit S. Hochbaum, Fabio Vandin	15(5):e1006802	2019	10.1371/journal.pcbi.1006802
Ariya Shajii, Ibrahim Numanagić, Bonnie Berger	Latent Variable Model for Aligning Barcoded Short-Reads Improves Downstream Analyses	280-282	10.1007/978-3-319-89929-9							
Dana Silverbush, Simona Cristea, Gali Yanovich, Tamar Geiger, Niko Beerenwinkel, Roded Sharan	ModulOmics: Integrating Multi-Omics Data to Identify Cancer Driver Modules.	283-284	10.1007/978-3-319-89929-9	bioRxiv 288399						
Jochen Singer, Jack Kuipers, Katharina Jahn, Niko Beerenwinkel	SCIO: Single-Cell Mutation Identification via Phylogenetic Inference	285-286	10.1007/978-3-319-89929-9							
Yijie Wang, Jan Hoinka, Piotr Swiderski, Teresa M. Przytycka	AptaBlocks: Accelerating the Design of RNA-Based Drug Delivery Systems	287-288	10.1007/978-3-319-89929-9		Nucleic Acids Research	AptaBlocks: Accelerating the Design of RNA-based Drug Delivery Systems	Yijie Wang, Jan Hoinka, Yong Liang, Tomasz Adamus, Piotr Swiderski, and Teresa M. Przytycka	46(16):8133-8142	2018	10.1093/nar/gky696
Yue Wu, Eleazar Eskin, Sriram Sankararaman	A Unifying Framework for Summary Statistic Imputation	289-290	10.1007/978-3-319-89929-9							
Naomi Yamada, William K. M. Lai, Nina Farrell, B. Franklin Pugh, Shaun Mahony	Characterizing Protein-DNA Binding Event Subtypes in ChIP-Exo Data	291-292	10.1007/978-3-319-89929-9							
Yang Yang, Quanquan Gu, Takayo Sasaki, Julianna Crivello, Rachel O'Neill, David M. Gilbert, Jian Ma	Continuous-Trait Probabilistic Model for Comparing Multi-species Functional Genomic Data.	293-294	10.1007/978-3-319-89929-9		Cell Systems	Continuous-Trait Probabilistic Model for Comparing Multi-species Functional Genomic Data	Yang Yang, Quanquan Gu, Yang Zhang, Takayo Sasaki, Julianna Crivello, Rachel J. O'Neill, David M. Gilbert, Jian Ma	7(2):208-218.e11	2018	10.1016/j.cels.2018.05.022
Tian-Ming Zhou, Sheng Wang, Jinbo Xu	Deep Learning Reveals Many More Inter-protein Residue-Residue Contacts than Direct Coupling Analysis	295-296	10.1007/978-3-319-89929-9							
